"Korean","Japanese","English","Chinese","German","French","Russian"
"좌우에 '힘'이 있을 때 '괴력'으로 진화한다.","左右に「力」がある時、「怪力」に進化する。","When there is 'strength' on the left and right, it evolves into 'monstrous strength'.","当左右两翼都拥有“力量”时，就会演变成“恐怖的力量”。","Wenn links und rechts „Stärke“ vorhanden ist, entwickelt sich daraus „monströse Stärke“.","Lorsque la « force » est présente à gauche et à droite, elle se transforme en « force monstrueuse ».","Когда «сила» присутствует слева и справа, она перерастает в «чудовищную силу»."
"왼쪽에 '분노'가 있으면 '광분'으로 진화합니다.","左側に「怒り」がある場合は「光分」に進化します。","If there is 'Rage' on the left, it evolves into 'Frenzy'.","左边是“愤怒”，右边是“狂暴”。","Wenn links „Wut“ vorhanden ist, entwickelt sich daraus „Raserei“.","Si la « Rage » est présente à gauche, elle évolue en « Frénésie ».","Если слева находится «Ярость», то она перерастает в «Безумие»."
"왼쪽에 '마력탄'이 있을 때 제거 후 '매직 미사일'로 진화한다.","左側に「魔力弾」がある時、除去後「マジックミサイル」に進化する。","When there is a 'Magic Bullet' on the left, it evolves into a 'Magic Missile' after removing it.","当左侧出现“魔法子弹”时，将其移除后会进化成“魔法导弹”。","Wenn sich links eine „Magische Kugel“ befindet, entwickelt sie sich nach deren Entfernung zu einer „Magischen Rakete“.","Lorsqu'une « Balle Magique » se trouve à gauche, elle se transforme en « Missile Magique » après avoir été retirée.","Если слева находится «Волшебная пуля», после её удаления она превращается в «Волшебную ракету»."
"표창을 생성해 현재 룰렛의 빈칸이 없다면 '갈고리 표창 주머니'로 진화합니다.","表彰を生成し、現在ルーレットの空白がない場合は「フック表彰ポケット」に進化します。","If you create a spear and there are no empty spaces on the current roulette, it will evolve into a 'Hooked Spear Pouch'.","如果你制作了一支长矛，而当前轮盘上没有空位，它将进化成“钩矛袋”。","Wenn du einen Speer herstellst und auf dem aktuellen Roulettefeld keine leeren Felder vorhanden sind, entwickelt er sich zu einer „Hakenspeertasche“.","Si vous créez une lance et qu'il n'y a pas d'emplacements vides sur la roulette actuelle, elle évoluera en une « poche à lance à crochet ».","Если вы создадите копье, и на текущей рулетке не будет пустых мест, оно превратится в «Мешок с крюком из копья»."
"양쪽 중 한 곳에 '화염'이 있으면 '화염병'으로 진화한다.","両方のうちの1つに「炎」があると、「炎炎病」に進化する。","If there is 'Flame' on either side, it evolves into 'Fire Bottle'.","如果两侧都有“火焰”，则会进化成“火焰瓶”。","Befindet sich auf einer der beiden Seiten ein „Flammen“-Symbol, entwickelt es sich zu einer „Feuerflasche“.","S'il y a « Flamme » de chaque côté, cela évolue en « Bouteille de Feu ».","Если с обеих сторон появляется «Пламя», оно превращается в «Огненную бутылку»."
"10이상의 마력을 사용 시 마력 폭발로 진화한다.","10以上の魔力を使用時魔力爆発に進化する。","When using 10 or more magic power, it evolves into magic explosion.","使用10点或以上魔力时，会进化成魔法爆炸。","Bei Verwendung von 10 oder mehr magischen Kräften entwickelt sich daraus eine magische Explosion.","Lorsqu'elle utilise 10 points ou plus de puissance magique, elle se transforme en explosion magique.","При использовании 10 или более единиц магической силы, эффект превращается в магический взрыв."
